{
	"_version": "1.79.0",
	"sap.app": {
		"id": "com.example.app",
		"type": "application",
		"applicationVersion": {
			"version": "1.0.0"
		}
	},
	"sap.ui": {
		"technology": "UI5",
		"deviceTypes": {
			"desktop": true,
			"tablet": true,
			"phone": true
		}
	},
	"sap.ui5": {
		"dependencies": {
			"minUI5Version": "1.120.0",
			"libs": {
				"sap.m": {}
			}
		}
	}
}
